{
  "action_id": "action-pilot-shadow",
  "admissibility_error": false,
  "aggregation_eligibility": false,
  "authorization_error": false,
  "calibration_class": "not_aggregable",
  "calibration_id": "cal-1",
  "decision_basis": {
    "decision_node_id": "node-admissibility_decision",
    "summary": "Prior success estimate from similar runs"
  },
  "integrity": {
    "content_digest": "sha256:8d70fba32997c0bdc8ef8da676c8a772996215d9b037d48040a53e27e5336280",
    "created_at": "2026-07-03T12:00:00Z",
    "schema_version": "v1",
    "writer_identity": "fixture-builder"
  },
  "missingness": {
    "fields": [
      {
        "field": "realized_outcome_id",
        "reason": "delayed unresolved"
      }
    ],
    "has_missing_fields": true
  },
  "predicted_cost": 100.0,
  "predicted_information_gain": null,
  "predicted_risk": null,
  "predicted_success": 0.7,
  "predicted_time": 3600.0,
  "prediction_presence": {
    "cost": true,
    "information_gain": false,
    "risk": false,
    "success": true,
    "time": true
  },
  "prioritization_error": false,
  "privacy": "public",
  "realized_cost": 110.0,
  "realized_information_gain": null,
  "realized_outcome_id": null,
  "realized_success": true,
  "realized_time": 4000.0,
  "schema_version": "v1",
  "uncertainty": {
    "statement": "Prediction from historical rates"
  },
  "verifier_disagreement": {
    "present": false,
    "summary": null
  }
}
