{
  "action_id": "action-fixture",
  "admissibility_error": false,
  "aggregation_eligibility": false,
  "authorization_error": false,
  "calibration_class": "not_aggregable",
  "calibration_id": "cal-missing-pred",
  "decision_basis": {
    "decision_node_id": "node-admissibility_decision",
    "summary": "Prior success estimate from similar runs"
  },
  "integrity": {
    "content_digest": "sha256:7314cbb4f1b35842cb88f0370ba344aca084a5825b690239323d07ac586b07ce",
    "created_at": "2026-07-03T12:00:00Z",
    "schema_version": "v1",
    "writer_identity": "fixture-builder"
  },
  "missingness": {
    "fields": [
      {
        "field": "predictions",
        "reason": "not available"
      }
    ],
    "has_missing_fields": true
  },
  "predicted_cost": null,
  "predicted_information_gain": null,
  "predicted_risk": null,
  "predicted_success": null,
  "predicted_time": null,
  "prediction_presence": {
    "cost": false,
    "information_gain": false,
    "risk": false,
    "success": false,
    "time": false
  },
  "prioritization_error": false,
  "privacy": "public",
  "realized_cost": 110.0,
  "realized_information_gain": null,
  "realized_outcome_id": null,
  "realized_success": true,
  "realized_time": 4000.0,
  "schema_version": "v1",
  "uncertainty": {
    "statement": "Prediction from historical rates"
  },
  "verifier_disagreement": {
    "present": false,
    "summary": null
  }
}
